{
  "schema_version":"1.0.0","delivery_id":"DELIVERY-1","revision":1,"workspace_id":"workspace-1",
  "binding":{"workspace_id":"workspace-1","source_snapshot_id":"SOURCE-1","source_revision":1,"source_digest":"aaaaaaaaaaaaaaaaaaaaaaaaaaaaaaaaaaaaaaaaaaaaaaaaaaaaaaaaaaaaaaaa","case_analysis_snapshot_id":"CASE-1","case_analysis_revision":2,"case_analysis_digest":"aaaaaaaaaaaaaaaaaaaaaaaaaaaaaaaaaaaaaaaaaaaaaaaaaaaaaaaaaaaaaaaa","planning_snapshot_id":"PLAN-1","planning_revision":3,"planning_digest":"aaaaaaaaaaaaaaaaaaaaaaaaaaaaaaaaaaaaaaaaaaaaaaaaaaaaaaaaaaaaaaaa","inspection_snapshot_id":"INSPECTION-1","inspection_revision":4,"inspection_digest":"aaaaaaaaaaaaaaaaaaaaaaaaaaaaaaaaaaaaaaaaaaaaaaaaaaaaaaaaaaaaaaaa","technical_snapshot_id":"TECHNICAL-1","technical_revision":5,"technical_digest":"aaaaaaaaaaaaaaaaaaaaaaaaaaaaaaaaaaaaaaaaaaaaaaaaaaaaaaaaaaaaaaaa","report_snapshot_id":"REPORT-1","report_revision":6,"report_digest":"aaaaaaaaaaaaaaaaaaaaaaaaaaaaaaaaaaaaaaaaaaaaaaaaaaaaaaaaaaaaaaaa","report_approval_id":"REPORT-APPROVAL-1","report_approval_digest":"aaaaaaaaaaaaaaaaaaaaaaaaaaaaaaaaaaaaaaaaaaaaaaaaaaaaaaaaaaaaaaaa","professional_id":"EXPERT-1"},
  "template_id":"TEMPLATE-1","template_content_id":"22222222-2222-4222-8222-222222222222","template_format":"DOCX","template_revision":1,"template_digest":"aaaaaaaaaaaaaaaaaaaaaaaaaaaaaaaaaaaaaaaaaaaaaaaaaaaaaaaaaaaaaaaa","rendering_version":"delivery-renderer/1.1.0","artifacts":[],"package":{"manifest_version":"1.0.0","artifact_ids":[]},"decisions":[],"state":"DRAFT","stale_reasons":[],"stale_origin_state":null,"supersedes_delivery_id":null
}
